{
  "$schema": "http://json-schema.org/draft-06/schema",
  "type": "object",
  "properties": {
    "version": {
      "type": "number"
    },
    "success": {
      "type": "boolean"
    },
    "reason": {},
    "content": {
      "type": "object",
      "properties": {
        "ok": {
          "type": "boolean"
        },
        "url": {
          "type": "string"
        },
        "status_code": {
          "type": "integer"
        },
        "reason": {
          "type": "string"
        },
        "cookies": {
          "type": "object",
          "properties": {
            "sails.sid": {
              "type": "string"
            }
          }
        },
        "headers": {
          "type": "object",
          "properties": {
            "Date": {
              "type": "string"
            },
            "Content-Type": {
              "type": "string"
            },
            "Content-Length": {
              "type": "string"
            },
            "Connection": {
              "type": "string"
            },
            "ETag": {
              "type": "string"
            },
            "set-cookie": {
              "type": "string"
            }
          }
        },
        "elapsed": {
          "type": "integer"
        },
        "apparent_encoding": {
          "type": "string"
        },
        "text": {
          "type": "string"
        },
        "json": {
          "type": "object",
          "properties": {
            "args": {
              "type": "object",
              "properties": {
                "key": {
                  "type": "string"
                }
              }
            },
            "headers": {
              "type": "object",
              "properties": {
                "x-forwarded-proto": {
                  "type": "string"
                },
                "x-forwarded-port": {
                  "type": "string"
                },
                "host": {
                  "type": "string"
                },
                "x-amzn-trace-id": {
                  "type": "string"
                },
                "content-length": {
                  "type": "string"
                },
                "user-agent": {
                  "type": "string"
                },
                "accept-encoding": {
                  "type": "string"
                },
                "accept": {
                  "type": "string"
                },
                "content-type": {
                  "type": "string"
                },
                "x-frooble": {
                  "type": "string"
                },
                "authorization": {
                  "type": "string"
                }
              }
            },
            "url": {
              "type": "string"
            }
          }
        },
        "links": {
          "type": "object"
        }
      }
    },
    "raw": {},
    "inputs": {
      "type": "object",
      "properties": {
        "rest_api_headers": {
          "type": "string"
        },
        "rest_api_method": {
          "type": "string"
        },
        "rest_api_verify": {
          "type": "boolean"
        },
        "rest_api_allowed_status_codes": {
          "type": "string"
        },
        "rest_api_url": {
          "type": "string"
        },
        "rest_api_body": {
          "type": "string"
        }
      }
    },
    "metrics": {
      "type": "object",
      "properties": {
        "version": {
          "type": "string"
        },
        "package": {
          "type": "string"
        },
        "package_version": {
          "type": "string"
        },
        "host": {
          "type": "string"
        },
        "execution_time_ms": {
          "type": "integer"
        },
        "timestamp": {
          "type": "string"
        }
      }
    }
  }
}